{
  "$schema": "https://raw.githubusercontent.com/Aksth070600/autoresearch-acts-seeding/main/orchestration-files/campaign-status.schema.json",
  "attempts": [
    {
      "candidate": "Genesis",
      "classification": "baseline",
      "duration_seconds": 800.15,
      "finished_at": "2026-08-28T11:04:42.448899Z",
      "implementation_commit": "dd252d3164414f88396fa56f8b1bd012e694bfa6",
      "links": {
        "commit": "https://github.com/Aksth070600/autoresearch-acts-seeding",
        "record": "https://github.com/Aksth070600/autoresearch-acts-seeding/blob/autoresearch-acts-seeding/campaign-v8/records/Development/20260828T105122298587Z-Genesis/summary.json"
      },
      "mechanism_family": "fresh Genesis baseline",
      "outcome": "Passed all controlled Development stages.",
      "record": "records/Development/20260828T105122298587Z-Genesis/summary.json",
      "started_at": "2026-08-28T10:51:22.298587Z",
      "state": "completed",
      "timed_ambiguity_particle_efficiency": 0.972769,
      "timed_seeding_time_per_event_ms": 298.25
    },
    {
      "candidate": "CorePackedVarianceLayout",
      "classification": "structural",
      "duration_seconds": 795.443,
      "finished_at": "2026-08-28T11:23:08.912395Z",
      "implementation_commit": "f2b67d563534d56c59d4a39be432a5c36a917b51",
      "links": {
        "commit": "https://github.com/Aksth070600/autoresearch-acts-seeding/commit/f2b67d563534d56c59d4a39be432a5c36a917b51",
        "record": "https://github.com/Aksth070600/autoresearch-acts-seeding/blob/autoresearch-acts-seeding/campaign-v8/records/Development/20260828T110953Z-CorePackedVarianceLayout/summary.json"
      },
      "mechanism_family": "core-packed-variance-layout",
      "outcome": "Passed all controlled Development stages.",
      "record": "records/Development/20260828T110953Z-CorePackedVarianceLayout/summary.json",
      "started_at": "2026-08-28T11:09:53.469158Z",
      "state": "completed",
      "timed_ambiguity_particle_efficiency": 0.972769,
      "timed_seeding_time_per_event_ms": 295.35
    },
    {
      "candidate": "CandidateCachedMinimumRetention",
      "classification": "structural",
      "duration_seconds": 814.959,
      "finished_at": "2026-08-28T11:38:41.059043Z",
      "implementation_commit": "8e874f98ab80353de2dd3b153f2f095afb31a7b6",
      "links": {
        "commit": "https://github.com/Aksth070600/autoresearch-acts-seeding/commit/8e874f98ab80353de2dd3b153f2f095afb31a7b6",
        "record": "https://github.com/Aksth070600/autoresearch-acts-seeding/blob/autoresearch-acts-seeding/campaign-v8/records/Development/20260828T112506Z-CandidateCachedMinimumRetention/summary.json"
      },
      "mechanism_family": "candidate-cached-minimum-retention",
      "outcome": "Passed all controlled Development stages.",
      "record": "records/Development/20260828T112506Z-CandidateCachedMinimumRetention/summary.json",
      "started_at": "2026-08-28T11:25:06.100047Z",
      "state": "completed",
      "timed_ambiguity_particle_efficiency": 0.972769,
      "timed_seeding_time_per_event_ms": 295.54
    },
    {
      "candidate": "TripletKinematicsPairLayout",
      "classification": "structural",
      "duration_seconds": 814.04,
      "finished_at": "2026-08-28T11:54:04.760346Z",
      "implementation_commit": "c0fdd671861e00af7c71c710e65787b677b6db38",
      "links": {
        "commit": "https://github.com/Aksth070600/autoresearch-acts-seeding/commit/c0fdd671861e00af7c71c710e65787b677b6db38",
        "record": "https://github.com/Aksth070600/autoresearch-acts-seeding/blob/autoresearch-acts-seeding/campaign-v8/records/Development/20260828T114030Z-TripletKinematicsPairLayout/summary.json"
      },
      "mechanism_family": "triplet-kinematics-pair-layout",
      "outcome": "Passed all controlled Development stages.",
      "record": "records/Development/20260828T114030Z-TripletKinematicsPairLayout/summary.json",
      "started_at": "2026-08-28T11:40:30.720321Z",
      "state": "completed",
      "timed_ambiguity_particle_efficiency": 0.972769,
      "timed_seeding_time_per_event_ms": 294.61
    },
    {
      "candidate": "GridBinAdaptiveRadixSort",
      "classification": "structural",
      "duration_seconds": 778.632,
      "finished_at": "2026-08-28T12:08:46.679581Z",
      "implementation_commit": "0256a37b6cd54a318e57c32935c1b157fc876843",
      "links": {
        "commit": "https://github.com/Aksth070600/autoresearch-acts-seeding/commit/0256a37b6cd54a318e57c32935c1b157fc876843",
        "record": "https://github.com/Aksth070600/autoresearch-acts-seeding/blob/autoresearch-acts-seeding/campaign-v8/records/Development/20260828T115548Z-GridBinAdaptiveRadixSort/summary.json"
      },
      "mechanism_family": "grid-bin-adaptive-radix-sort",
      "outcome": "Passed all controlled Development stages.",
      "record": "records/Development/20260828T115548Z-GridBinAdaptiveRadixSort/summary.json",
      "started_at": "2026-08-28T11:55:48.047256Z",
      "state": "completed",
      "timed_ambiguity_particle_efficiency": 0.972769,
      "timed_seeding_time_per_event_ms": 294.44
    },
    {
      "candidate": "DoubletSlopeErrorPairLayout",
      "classification": "structural",
      "duration_seconds": 808.828,
      "finished_at": "2026-08-28T12:23:53.051581Z",
      "implementation_commit": "08250bbb8cef262cd3cc80bf98b8979976ae207f",
      "links": {
        "commit": "https://github.com/Aksth070600/autoresearch-acts-seeding/commit/08250bbb8cef262cd3cc80bf98b8979976ae207f",
        "record": "https://github.com/Aksth070600/autoresearch-acts-seeding/blob/autoresearch-acts-seeding/campaign-v8/records/Development/20260828T121024Z-DoubletSlopeErrorPairLayout/summary.json"
      },
      "mechanism_family": "doublet-slope-error-pair-layout",
      "outcome": "Passed all controlled Development stages.",
      "record": "records/Development/20260828T121024Z-DoubletSlopeErrorPairLayout/summary.json",
      "started_at": "2026-08-28T12:10:24.223747Z",
      "state": "completed",
      "timed_ambiguity_particle_efficiency": 0.972769,
      "timed_seeding_time_per_event_ms": 296.66
    },
    {
      "candidate": "DoubletCotThetaIDeltaRMaterialization",
      "classification": "structural",
      "duration_seconds": 815.444,
      "finished_at": "2026-08-28T12:40:00.543926Z",
      "implementation_commit": "c1e8be71f49b443e2010da94461896a25fdeb00e",
      "links": {
        "commit": "https://github.com/Aksth070600/autoresearch-acts-seeding/commit/c1e8be71f49b443e2010da94461896a25fdeb00e",
        "record": "https://github.com/Aksth070600/autoresearch-acts-seeding/blob/autoresearch-acts-seeding/campaign-v8/records/Development/20260828T122625Z-DoubletCotThetaIDeltaRMaterialization/summary.json"
      },
      "mechanism_family": "doublet-cottheta-ideltar-materialization",
      "outcome": "Passed all controlled Development stages.",
      "record": "records/Development/20260828T122625Z-DoubletCotThetaIDeltaRMaterialization/summary.json",
      "started_at": "2026-08-28T12:26:25.099454Z",
      "state": "completed",
      "timed_ambiguity_particle_efficiency": 0.972769,
      "timed_seeding_time_per_event_ms": 302.74
    },
    {
      "candidate": "FilterRadiusOrderedCompatibility",
      "classification": "structural",
      "duration_seconds": 802.31,
      "finished_at": "2026-08-28T12:55:13.960458Z",
      "implementation_commit": "835193fbeaf086710acc5833eb6c6aa987758fa6",
      "links": {
        "commit": "https://github.com/Aksth070600/autoresearch-acts-seeding/commit/835193fbeaf086710acc5833eb6c6aa987758fa6",
        "record": "https://github.com/Aksth070600/autoresearch-acts-seeding/blob/autoresearch-acts-seeding/campaign-v8/records/Development/20260828T124151Z-FilterRadiusOrderedCompatibility/summary.json"
      },
      "mechanism_family": "filter-radius-ordered-compatibility-selection",
      "outcome": "Passed all controlled Development stages.",
      "record": "records/Development/20260828T124151Z-FilterRadiusOrderedCompatibility/summary.json",
      "started_at": "2026-08-28T12:41:51.650904Z",
      "state": "completed",
      "timed_ambiguity_particle_efficiency": 0.972769,
      "timed_seeding_time_per_event_ms": 300.35
    },
    {
      "candidate": "CorePackedXYZRLayout",
      "classification": "structural",
      "duration_seconds": 154.203,
      "finished_at": "2026-08-28T13:00:17.504467Z",
      "implementation_commit": "86b78fad06516e99372f8951349032ce0af8c52d",
      "links": {
        "commit": "https://github.com/Aksth070600/autoresearch-acts-seeding/commit/86b78fad06516e99372f8951349032ce0af8c52d",
        "record": "https://github.com/Aksth070600/autoresearch-acts-seeding/blob/autoresearch-acts-seeding/campaign-v8/records/Failed/20260828T125743Z-CorePackedXYZRLayout/summary.json"
      },
      "mechanism_family": "core-packed-xyzr-layout",
      "outcome": "candidate failed stage: ten_event_seeding",
      "record": "records/Failed/20260828T125743Z-CorePackedXYZRLayout/summary.json",
      "started_at": "2026-08-28T12:57:43.301880Z",
      "state": "failed",
      "timed_ambiguity_particle_efficiency": null,
      "timed_seeding_time_per_event_ms": null
    },
    {
      "candidate": "CorePackedXYZRLayout",
      "classification": "structural",
      "duration_seconds": 852.113,
      "finished_at": "2026-08-28T13:15:55.812932Z",
      "implementation_commit": "f35abcd80f64400c9df6ca78b6ea04937bb06f9b",
      "links": {
        "commit": "https://github.com/Aksth070600/autoresearch-acts-seeding/commit/f35abcd80f64400c9df6ca78b6ea04937bb06f9b",
        "record": "https://github.com/Aksth070600/autoresearch-acts-seeding/blob/autoresearch-acts-seeding/campaign-v8/records/Development/20260828T130143Z-CorePackedXYZRLayout/summary.json"
      },
      "mechanism_family": "core-packed-xyzr-layout",
      "outcome": "Passed all controlled Development stages.",
      "record": "records/Development/20260828T130143Z-CorePackedXYZRLayout/summary.json",